{"schema":"runtime-env/module/v1","id":"openshell-agent-providers","summary":"OpenShell provider names and gateway routing for isolated Claude and Codex carriers; credential values stay in carrier stores and the gateway.","requires":[],"optional":["OPENSHELL_CLAUDE_PROVIDER","OPENSHELL_CODEX_PROVIDER","OPENSHELL_GATEWAY","OPENSHELL_GATEWAY_ENDPOINT"],"defaults":{"OPENSHELL_CLAUDE_PROVIDER":"claude-code","OPENSHELL_CODEX_PROVIDER":"codex-runtime-env"}}
