{"schema":"runtime-env/module/v1","id":"browser-transport-stealth-playwright","summary":"stealth-browser Playwright/MCP transport with credential-bearing profiles kept host-only and untracked.","requires":["STEALTH_BROWSER_ROOT","STEALTH_PROFILE_ROOT"],"optional":["STEALTH_BROWSER_EXTRA_ALLOW","STEALTH_DEBUG_LOG","STEALTH_LANGUAGES","STEALTH_USER_AGENT"],"defaults":{}}
